{
  "_meta": {
    "version": "1.0.0",
    "createdAt": "2026-05-23",
    "description": "Pokémon Guardian Game — 測驗與推薦規則資料檔",
    "note": "本檔案為非官方粉絲向企劃的規則設定，不含官方圖片，不修改 data/pokemon.json"
  },

  "locale": {
    "zh_tw": {
      "language": "繁體中文",
      "tone": ["補運", "五行", "守護位", "氣場", "陪伴"],
      "uiLabels": {
        "quizTitle": "找到你的寶可夢守護夥伴",
        "resultTitle": "你的守護寶可夢",
        "retakeBtn": "重新測驗",
        "shareBtn": "分享結果",
        "officialLinkBtn": "前往官方 30 週年頁面查看圖案"
      }
    },
    "en": {
      "language": "English",
      "tone": ["energy", "aura", "comfort", "healing", "match", "current state"],
      "uiLabels": {
        "quizTitle": "Find Your Pokémon Energy Match",
        "resultTitle": "Your Pokémon Guardian",
        "retakeBtn": "Retake Quiz",
        "shareBtn": "Share Result",
        "officialLinkBtn": "View the official 30th anniversary artwork"
      }
    },
    "ja": {
      "language": "日本語",
      "tone": ["癒し", "お守り", "気配", "整える", "寄り添う"],
      "uiLabels": {
        "quizTitle": "あなたに寄り添うポケモンを見つけよう",
        "resultTitle": "あなたの守護ポケモン",
        "retakeBtn": "もう一度診断する",
        "shareBtn": "結果をシェアする",
        "officialLinkBtn": "公式30周年ページでアイコンを見る"
      }
    }
  },

  "fiveElements": {
    "木": {
      "element": "木",
      "zh_tw": {
        "meaning": ["成長", "舒展", "學習", "新開始"],
        "description": "木代表向上的生命力，適合正在開展新計畫、學習新事物或需要突破卡關狀態的時期。"
      },
      "en": {
        "meaning": ["growth", "renewal", "learning", "expansion"],
        "description": "Wood energy represents upward vitality — ideal when starting something new, building momentum, or breaking through stagnation."
      },
      "ja": {
        "meaning": ["成長", "芽吹き", "学び", "広がり"],
        "description": "木のエネルギーは上へ伸びる生命力。新しいことを始めたい、学びを深めたい、停滞を抜け出したいときにぴったりです。"
      }
    },
    "火": {
      "element": "火",
      "zh_tw": {
        "meaning": ["行動", "熱情", "曝光", "啟動"],
        "description": "火代表驅動與熱力，適合需要提振幹勁、加強人際存在感或推動事情快速啟動的時期。"
      },
      "en": {
        "meaning": ["action", "passion", "visibility", "ignition"],
        "description": "Fire energy brings drive and warmth — great for pushing things forward, showing up more boldly, or reigniting motivation."
      },
      "ja": {
        "meaning": ["行動力", "情熱", "明るさ", "始動"],
        "description": "火のエネルギーは情熱と推進力。やる気を高めたい、存在感を出したい、物事を動かしたいときに力を発揮します。"
      }
    },
    "土": {
      "element": "土",
      "zh_tw": {
        "meaning": ["穩定", "承載", "休息", "生活感"],
        "description": "土代表厚實的承載能力，適合需要找回踏實感、建立規律日常或讓自己好好喘口氣的時期。"
      },
      "en": {
        "meaning": ["stability", "grounding", "rest", "daily rhythm"],
        "description": "Earth energy provides a steady foundation — helpful when you need to recharge, establish routines, or simply feel more settled in your day."
      },
      "ja": {
        "meaning": ["安定", "土台", "休息", "暮らし"],
        "description": "土のエネルギーはしっかりした土台。日常を整えたい、疲れを取りたい、地に足をつけたいときに支えてくれます。"
      }
    },
    "金": {
      "element": "金",
      "zh_tw": {
        "meaning": ["專注", "決策", "效率", "秩序"],
        "description": "金代表清晰的判斷力，適合需要整理思緒、做出決定或提升工作效率的時期。"
      },
      "en": {
        "meaning": ["focus", "decision", "efficiency", "structure"],
        "description": "Metal energy sharpens clarity — ideal for cutting through noise, making decisions with confidence, and creating order in your environment."
      },
      "ja": {
        "meaning": ["集中", "判断", "効率", "秩序"],
        "description": "金のエネルギーは鋭い判断力と集中力。頭を整理したい、決断したい、効率よく進めたいときに役立ちます。"
      }
    },
    "水": {
      "element": "水",
      "zh_tw": {
        "meaning": ["修復", "情緒", "直覺", "流動"],
        "description": "水代表深層的滋養與流動，適合情緒需要照料、壓力偏大或想找回直覺感知的時期。"
      },
      "en": {
        "meaning": ["healing", "emotion", "intuition", "flow"],
        "description": "Water energy restores and softens — supportive when you're processing feelings, recovering from stress, or want to reconnect with your inner sense of things."
      },
      "ja": {
        "meaning": ["癒し", "感情", "直感", "流れ"],
        "description": "水のエネルギーは深い回復力と流動性。感情を整えたい、疲れを癒したい、直感を取り戻したいときにそっと寄り添います。"
      }
    }
  },

  "birthElementRules": {
    "_note": "出生資料簡化五行推算，非命理學精確計算，僅作輕量補位參考",
    "monthRules": {
      "scores": {
        "木": [2, 3, 4],
        "火": [5, 6, 7],
        "金": [8, 9, 10],
        "水": [11, 12, 1]
      },
      "weight": 2,
      "description": {
        "zh_tw": "出生月份對應四季五行，土貫穿四季故不列入月份主偏",
        "en": "Birth month maps to seasonal five elements; Earth spans all seasons and is excluded from monthly bias",
        "ja": "生まれた月は季節の五行に対応します。土は四季を貫くため月の主偏には含まれません"
      }
    },
    "dayDigitRules": {
      "scores": {
        "木": [1, 2],
        "火": [3, 4],
        "土": [5, 6],
        "金": [7, 8],
        "水": [9, 0]
      },
      "weight": 1,
      "description": {
        "zh_tw": "生日個位數字對應元素補充",
        "en": "The last digit of birth day maps to a supplementary element",
        "ja": "生まれた日の一の位が補足する五行に対応します"
      }
    },
    "hourRules": {
      "scores": {
        "水": ["子", "亥"],
        "木": ["寅", "卯"],
        "火": ["巳", "午"],
        "金": ["申", "酉"],
        "土": ["辰", "戌", "丑", "未"]
      },
      "chinesHourMap": {
        "子": "23:00–00:59",
        "丑": "01:00–02:59",
        "寅": "03:00–04:59",
        "卯": "05:00–06:59",
        "辰": "07:00–08:59",
        "巳": "09:00–10:59",
        "午": "11:00–12:59",
        "未": "13:00–14:59",
        "申": "15:00–16:59",
        "酉": "17:00–18:59",
        "戌": "19:00–20:59",
        "亥": "21:00–22:59"
      },
      "weight": 1,
      "description": {
        "zh_tw": "出生時段對應地支五行，以 24 小時制對照",
        "en": "Birth hour maps to earthly branch elements using 24-hour time ranges",
        "ja": "生まれた時刻を十二支の五行に対応させます（24時間制）"
      },
      "birthTime": {
        "optional": true,
        "unknownValue": "unknown",
        "unknownScore": 0,
        "unknownLabel": {
          "zh_tw": "不知道／略過",
          "en": "I don't know / Skip",
          "ja": "わからない／スキップ"
        }
      }
    }
  },

  "quizQuestions": [
    {
      "id": "q1",
      "order": 1,
      "zh_tw": {
        "question": "最近比較接近哪種狀態？",
        "options": [
          {
            "id": "q1a",
            "label": "A",
            "text": "思緒很多，需要安靜整理",
            "tags": ["安定", "修復", "低刺激"]
          },
          {
            "id": "q1b",
            "label": "B",
            "text": "有點提不起勁，需要重新啟動",
            "tags": ["行動", "成長", "啟動"]
          },
          {
            "id": "q1c",
            "label": "C",
            "text": "情緒比較滿，需要柔和陪伴",
            "tags": ["陪伴", "修復", "柔和"]
          },
          {
            "id": "q1d",
            "label": "D",
            "text": "人際消耗較多，需要保留空間",
            "tags": ["守護", "安定", "距離感"]
          },
          {
            "id": "q1e",
            "label": "E",
            "text": "想往前推進，但需要更清楚的方向",
            "tags": ["專注", "效率", "秩序"]
          }
        ]
      },
      "en": {
        "question": "Which of these feels closest to where you are right now?",
        "options": [
          {
            "id": "q1a",
            "label": "A",
            "text": "My mind is running a lot — I need some quiet to sort things out",
            "tags": ["安定", "修復", "低刺激"]
          },
          {
            "id": "q1b",
            "label": "B",
            "text": "I've lost momentum and need something to restart the engine",
            "tags": ["行動", "成長", "啟動"]
          },
          {
            "id": "q1c",
            "label": "C",
            "text": "Feeling emotionally full — I just want gentle company",
            "tags": ["陪伴", "修復", "柔和"]
          },
          {
            "id": "q1d",
            "label": "D",
            "text": "People have been draining me — I need to protect my energy",
            "tags": ["守護", "安定", "距離感"]
          },
          {
            "id": "q1e",
            "label": "E",
            "text": "I want to move forward, but I need a clearer sense of direction",
            "tags": ["專注", "效率", "秩序"]
          }
        ]
      },
      "ja": {
        "question": "最近、自分に一番近いのはどの状態ですか？",
        "options": [
          {
            "id": "q1a",
            "label": "A",
            "text": "頭の中がにぎやかで、静かに整理したい",
            "tags": ["安定", "修復", "低刺激"]
          },
          {
            "id": "q1b",
            "label": "B",
            "text": "なんとなくやる気が出なくて、もう一度スイッチを入れたい",
            "tags": ["行動", "成長", "啟動"]
          },
          {
            "id": "q1c",
            "label": "C",
            "text": "感情がいっぱいで、そっと寄り添ってほしい",
            "tags": ["陪伴", "修復", "柔和"]
          },
          {
            "id": "q1d",
            "label": "D",
            "text": "人と関わることで消耗していて、自分の空間を守りたい",
            "tags": ["守護", "安定", "距離感"]
          },
          {
            "id": "q1e",
            "label": "E",
            "text": "前に進みたいけど、もっとはっきりした方向が欲しい",
            "tags": ["專注", "效率", "秩序"]
          }
        ]
      }
    },
    {
      "id": "q2",
      "order": 2,
      "zh_tw": {
        "question": "你現在最想讓哪一部分變得更順？",
        "options": [
          {
            "id": "q2a",
            "label": "A",
            "text": "睡眠與放鬆",
            "tags": ["睡眠", "修復", "低刺激", "陰水"]
          },
          {
            "id": "q2b",
            "label": "B",
            "text": "工作專注",
            "tags": ["專注", "效率", "秩序", "陽金"]
          },
          {
            "id": "q2c",
            "label": "C",
            "text": "人際與好感",
            "tags": ["人際", "好感", "陪伴", "中性土"]
          },
          {
            "id": "q2d",
            "label": "D",
            "text": "財運與穩定",
            "tags": ["穩定", "財運", "安定", "陽土"]
          },
          {
            "id": "q2e",
            "label": "E",
            "text": "學習與成長",
            "tags": ["成長", "學習", "行動", "陽木"]
          }
        ]
      },
      "en": {
        "question": "What would you like to feel more at ease with right now?",
        "options": [
          {